{
  "soaHarnessVersion": "1.0",
  "name": "example-project-agent",
  "version": "1.0.0",
  "description": "Handles spreadsheet workflows with self-improvement",
  "url": "https://agent.example.com",
  "protocolVersion": "a2a-0.3",
  "agentType": "general-purpose",
  "skills": ["research", "coding", "analysis"],
  "provider": "anthropic",
  "self_improvement": {
    "enabled": true,
    "directive_file": "program.md",
    "editable_surfaces": ["system_prompt", "tool_definitions", "routing_logic"],
    "benchmark_mcp_endpoint": "mcp://benchmarks.internal/project-evals",
    "min_score_threshold": 0.85,
    "max_iterations": 50,
    "holdout_fraction": 0.2
  },
  "memory": {
    "enabled": true,
    "mcp_endpoint": "mcp://memory.internal/project",
    "type": "evolving-graph",
    "sharing_policy": "project",
    "aging_rules": { "temporal_indexing": true, "consolidation_threshold": "P30D", "max_in_context_tokens": 8000 },
    "in_context_strategy": { "weights": { "semantic_relevance": 0.5, "recency": 0.3, "graph_strength": 0.2 }, "tie_breaker": "importance" }
  },
  "permissions": { "activeMode": "ReadOnly", "handler": "Interactive", "toolRequirements": { "delete_file": "Prompt" }, "policyEndpoint": "https://policy.example.com" },
  "compaction": { "preserveRecentTurns": 4, "triggerTokens": 80000, "targetTokens": 40000 },
  "tokenBudget": { "maxTokensPerRun": 200000, "billingTag": "project-spreadsheet" },
  "observability": { "otelExporter": "https://otel.internal/ingest" },
  "security": {
    "oauthScopes": ["read:files", "write:artifacts"],
    "trustAnchors": [
      {
        "issuer": "CN=SOA Internal CA",
        "spki_sha256": "0123456789abcdef0123456789abcdef0123456789abcdef0123456789abcdef",
        "uri": "https://ca.example.com/soa-internal"
      }
    ],
    "auditSink": "https://audit.example.com/worm"
  }
}
